{
  "id": "quiz-level-03-week-10-01-state-remember-saveable",
  "title": "State, remember, and rememberSaveable Check",
  "categoryId": "level-03-jetpack-compose",
  "linkedLessonIds": [
    "level-03-week-10-01-state-remember-saveable"
  ],
  "kind": "lesson",
  "difficulty": "intermediate",
  "passingScore": 0.67,
  "questions": [
    {
      "id": "q-level-03-week-10-01-state-remember-saveable-decision",
      "prompt": "Which API suits a small text draft that should survive recreation?",
      "type": "single_choice",
      "difficulty": "intermediate",
      "answer": "rememberSaveable",
      "explanation": "A saveable draft can be stored in instance state and reconstructed with the destination.",
      "lessonId": "level-03-week-10-01-state-remember-saveable",
      "options": [
        "rememberSaveable",
        "A local val",
        "Canvas",
        "Modifier.drawBehind"
      ]
    },
    {
      "id": "q-level-03-week-10-01-state-remember-saveable-truth",
      "prompt": "remember is durable storage after process death.",
      "type": "true_false",
      "difficulty": "intermediate",
      "answer": false,
      "explanation": "remember lasts only while its composition identity remains alive.",
      "lessonId": "level-03-week-10-01-state-remember-saveable"
    },
    {
      "id": "q-level-03-week-10-01-state-remember-saveable-recall",
      "prompt": "What should saved UI state prefer storing?",
      "type": "short_answer",
      "difficulty": "intermediate",
      "answer": "Small reconstruction values",
      "explanation": "Small keys and user input avoid state-size limits and stale object graphs.",
      "lessonId": "level-03-week-10-01-state-remember-saveable"
    }
  ],
  "rewards": {
    "xp": 75,
    "stars": 3
  },
  "version": "0.5.0"
}
