{
  "id": "quiz-level-07-week-28-02-room-dao-transaction-migration-tests",
  "title": "Room DAO, Transaction, and Migration Tests Check",
  "categoryId": "level-07-testing-quality-engineering",
  "linkedLessonIds": [
    "level-07-week-28-02-room-dao-transaction-migration-tests"
  ],
  "kind": "lesson",
  "difficulty": "advanced",
  "passingScore": 0.67,
  "questions": [
    {
      "id": "q-level-07-week-28-02-room-dao-transaction-migration-tests-decision",
      "prompt": "Which approach gives the strongest evidence for room dao, transaction, and migration tests?",
      "type": "single_choice",
      "difficulty": "advanced",
      "options": [
        "Build DAO and transaction tests plus migration tests from every supported schema version, verifying constraints, invalidation, rollback, indices, and retained user data.",
        "Testing only fresh database creation while shipping an untested upgrade path for existing users.",
        "Run the largest possible test with live services",
        "Raise coverage without reviewing assertions"
      ],
      "answer": "Build DAO and transaction tests plus migration tests from every supported schema version, verifying constraints, invalidation, rollback, indices, and retained user data.",
      "explanation": "Strong evidence identifies a risk, uses sufficient fidelity, controls variables, and produces actionable failure information.",
      "lessonId": "level-07-week-28-02-room-dao-transaction-migration-tests"
    },
    {
      "id": "q-level-07-week-28-02-room-dao-transaction-migration-tests-truth",
      "prompt": "A passing test proves every behaviour in the production environment is correct.",
      "type": "true_false",
      "difficulty": "advanced",
      "answer": false,
      "explanation": "Every test has a defined scope, fidelity, inputs, and blind spots; confidence comes from complementary risk-based evidence.",
      "lessonId": "level-07-week-28-02-room-dao-transaction-migration-tests"
    },
    {
      "id": "q-level-07-week-28-02-room-dao-transaction-migration-tests-recall",
      "prompt": "What should a test failure report besides the assertion?",
      "type": "short_answer",
      "difficulty": "advanced",
      "answer": "Reproducible inputs, expected and observed state, environment, timeline, and relevant artifacts.",
      "explanation": "Diagnostic context turns a red check into an actionable engineering result.",
      "lessonId": "level-07-week-28-02-room-dao-transaction-migration-tests"
    }
  ],
  "rewards": {
    "xp": 50,
    "stars": 3
  },
  "version": "0.10.0"
}
