{
  "id": "quiz-level-09-week-36-02-build-types-flavours-variant-matrix",
  "title": "Build Types, Product Flavours, and the Variant Matrix Check",
  "categoryId": "level-09-gradle-build-cicd",
  "linkedLessonIds": [
    "level-09-week-36-02-build-types-flavours-variant-matrix"
  ],
  "kind": "lesson",
  "difficulty": "advanced",
  "passingScore": 0.67,
  "questions": [
    {
      "id": "q-level-09-week-36-02-build-types-flavours-variant-matrix-decision",
      "prompt": "Which approach best applies build types, product flavours, and the variant matrix?",
      "type": "single_choice",
      "difficulty": "advanced",
      "options": [
        "Use dimensions for real build-time product differences and explicitly prune unsupported cross-products.",
        "Store production credentials in a flavour",
        "Treat fallbacks as name aliases only",
        "Create a flavour per runtime experiment"
      ],
      "answer": "Use dimensions for real build-time product differences and explicitly prune unsupported cross-products.",
      "explanation": "The correct approach preserves Gradle’s lazy model, explicit data flow, variant correctness, functional evidence and operability.",
      "lessonId": "level-09-week-36-02-build-types-flavours-variant-matrix"
    },
    {
      "id": "q-level-09-week-36-02-build-types-flavours-variant-matrix-truth",
      "prompt": "Every flavour/build-type cross-product must be built and distributed.",
      "type": "true_false",
      "difficulty": "advanced",
      "answer": false,
      "explanation": "Adding a flavour for every feature flag multiplies variants, source sets and CI cost even when runtime configuration would model the capability safely.",
      "lessonId": "level-09-week-36-02-build-types-flavours-variant-matrix"
    },
    {
      "id": "q-level-09-week-36-02-build-types-flavours-variant-matrix-recall",
      "prompt": "What risk does matchingFallbacks introduce?",
      "type": "short_answer",
      "difficulty": "advanced",
      "answer": "A consumer may receive a different producer variant whose behaviour or dependencies are not semantically compatible.",
      "explanation": "The answer names the model property that makes the build behaviour predictable rather than relying on incidental script order.",
      "lessonId": "level-09-week-36-02-build-types-flavours-variant-matrix"
    }
  ],
  "rewards": {
    "xp": 55,
    "stars": 3
  },
  "version": "0.12.0"
}
